{
  "schema_version": 1,
  "kind": "ticket_evidence",
  "evidence_id": "native-dsh-skill-and-evidence-loop",
  "ticket_id": "ticket-build-task-harness-vertical-slice",
  "acceptance_ids": [
    "one-real-task-completes-the-execution-evidence-loop"
  ],
  "summary": "An installed DSH rc.8 Web Profile started this real READY Ticket from the embedded host-owned Recommended action, persisted the exact Workspace-to-Ticket linkage and handoff in native Chat, discovered and loaded the vendored vibehub-ticket-run Skill through the native skill tool, ran the production Bundle regression, and invoked the canonical VibeHub Evidence command. The replay adapter replaced only external model I/O; DSH Session, command, Skill, tool, sandbox, filesystem, and VibeHub write paths remained real, and no Outcome was written.",
  "refs": [
    "packages/dsh-adapter/client.js",
    "packages/dsh-bundle/cordis.patch.yml",
    "packages/dsh-adapter/linkage.mjs",
    "test/dsh-bundle.test.mjs",
    "test/fixtures/dsh-vibehub-run/replay.override.json",
    "docs/DEEPSEEK_HARNESS_V1.md"
  ],
  "origin": "agent",
  "recorded_at": "2026-08-20T23:42:00Z"
}
